"Британийн загварын зөвлөл хүйсээр ялгасан шоуг орхих шийдвэр гаргаснаар энэ зуны зургадугаар сараас хойш 12 сарын турш Лондоны загварын долоо хоног хүйсэнд баригдахгүй зохион байгуулагдаж байхаар болжээ. Зөвлөлийн өчигдөр /2020.04.21/ зарласан энэ алхам 2012 онд загвар зохион бүтээгчдийн үйлдвэрлэлээ өргөжүүлэх зорилгоор зохион байгуулагдаж эхэлсэн эрчүүдийн загварын долоо хоногт ашигтай завсарлага болж байна. Ийнхүү эрэгтэй, эмэгтэй загварыг ялгаж, зааглахгүйгээр хольж үзэх шийдвэр гарах үндсэн шалтгаан нь коронавирусийн цар тахал байв. Цар тахлаас болж дэлхийн загварын салбар хямралд орж, олон улсад дэлгүүрүүд хаагдаж, ажилчид нь захиалгаа цуцалж, өөр ажил олж хийхээс өөр аргагүйд хүрч байна. Улмаар хамгийн анхны “хүйсгүй” Лондоны загварын долоо хоног зургадугаар сарын 12-нд эхлэхээр боллоо. Гэхдээ хөл хорио, зай барих зэрэг дэглэм, дүрмийг баримталж, хоёроос дээш хүн цуглуулахгүй, олон нийтийн арга хэмжээ зохион байгуулахгүйгээр цахим хэлбэрээр болохоор боллоо. Их Британи өнөөгийн байдлаар л гэхэд 129 мянга гаруй иргэнийхээ эрүүл мэнд, тэр дундаа 17 мянга гаруй хүнийхээ амь насыг алдаж, цар тахалд чанга цохигдсон байгаа учир тийнхүү дэг журам баримтлах нь хамгаас чухал билээ. Зөвлөлийн мэдэгдсэнээр анхны “хүйсгүй” загварын долоо хоног загвар зохион бүтээгчдэд илүү уян хатан, хөрвөж ажиллах боломжийг олгохын сацуу шинэ боломжуудыг нээж, дэлхийн загварын салбарт өөр байдлаар үлгэр жишээ болох боломжийг олгож буй гэнэ. “Цар тахал нүүрлэсэн өнөө үед бид бүхэн амьдарч байгаа нийгэмдээ, өөр өөрсдийнхөөрөө амьдарч бизнесээ цаашид үргэлжлүүлэх тал дээр маш болгоомжтой ханддаг болгож байна. Харин нөгөө талаас бид илүү байгальд ээлтэй, бүтээлч, юмны үнэ цэнг сайн мэдэрдэг болох байх” хэмээн Британийн загварын зөвлөлийн гүйцэтгэх захирал Каролин Раш хэлжээ. Хувцас загварын салбар одоо ч биш аль хэдийнээс л хүйсэнд хязгаарлагдахаа больж, байгальд ээлтэй байх талаар бодож эхэлсэн билээ. Тиймээс зөвлөлийн энэ шийдвэрийн дагуу эрэгтэй загвар, эмэгтэй загварын шоуг нэг дор зохион байгуулахад цар тахал дууссаны дараа ч гэсэн болохгв гэх зүйлгүй билээ. Сүүлийн үед гарч ирж буй олон брендүүд өөрсдийгөө хүйсэнд зориулж ажилладаггүй гэж тодорхойлох бөгөөд нөгөө талаас ч өөрсдийгөө хүйсээр ялгуулахыг дургүйцэх болсон Z үеийнхний эрэлт үүнтэй сайн таарч байгаа юм. Өнгөрсөн үед харин загвар зохион бүтээгчид зарим нь хичнээн хүйс ялгахгүй ажиллана гэдэг ч ихэнхдээ худалдан авагч, хэвлэлүүдийн анхаарлын төвд илүү өртдөг эмэгтэй загварын салбарт ажиллах нь их байлаа. 2018 онд загвар зохион бүтээгчдийн зөвлөл Нью Йоркын загварын долоо хоногт шинээр гуравдагч төрөл оруулсан нь “Юнисекс/ хүйсгүй” гэх төрөл байсан юм. Энэ төрөлд тухайн үедээ Vaquera, Telfar зэрэг брендүүд хүйс хамаарахгүй өмсөж болох загваруудаа танилцуулж байлаа. Энэ нь хүмүүст хувцас хэрхэн хөрвөх чадвартай, хаягдал багатай, байгальд ээлтэй байж болох вэ гэдгийг олж харах өөр нэг шинэ цонх болсон билээ. Загварын шоуг цахим хэлбэрээр зохион байгуулах алхам ч гэсэн хөл хориотой, нислэг багатай, эрсдэлтэй энэ үед хамгийн ашигтай бөгөөд зөв, байгальд ээлтэй алхам болж байна. Энэ сарын эхээр Москвагийн загварын долоо хоног мөн ижил цахим хэлбэрээр зохион байгуулагдаж, богино кино контентүүд, сэтгүүл, зургийн цомог санал болгосон нь дэлхий даяар 800 мянган хүнд амжилттай хүрсэн гэнэ. Зохион байгуулагчид уг нь тайзны шоуг шууд дамжуулах аргаар зохион байгуулахаар төлөвлөсөн ч цөөн ч хамаагүй хүн цуглуулах нь эрсдэлтэй гэж үзээд цуцалсан байна. Британийн загварын зөвлөлийн мэдээлснээр Цахим загварын долоо хоногт загвар зохион бүтээгчдийн тэмдэглэл, танилцуулга, үзүүлэнгийн өрөө, сэтгэгдэл, подкаст зэрэг багтаж буй аж. “Энэ шийдвэр танд эрүүл, ганцаарчилсан үйлчилгээ санал болгож, уламжлал ёсоор маш их урам зориг өгж чадна гэдэгт бид итгэлтэй байна” хэмээн Раш ярьжээ. Эх сурвалж: CNN.COM",ЭНТЕРТАЙНМЕНТ
"Корона­вирусийн халдвараас сэргийлэх үүднээс Монголын боловсролын салбар танхимын сургалтаас “гэр сургууль” руу шилжээд чамгүй удаж байна. Харин шилдэг гэж үнэлэгдсэн багш нарын телевизээр зааж буй хичээлийг хүүхэд багачууд хэр ойлгож, хүлээн авч байна вэ гэдэг нь хамгийн чухал.  Сурагчид болон эцэг эхчүүдэд “гэр сургууль” зарим талаараа таалагдаж байгаа ч заах арга зүй болон хичээлээ хүүхдүүдэд хүргэж буй байдалд “нэг л тааруу” гэсэн дүн өгөх нь ч байна. Тэгвэл энэ асуудалд   салбарын сайд Е.Баатарбилэг тайлбар хийсэн юм. ТЕЛЕ ХИЧЭЭЛИЙН ҮР ДҮН НЬ ЭЦЭГ ЭХ, БАГШ, ХҮҮХЭД ГУРВЫН ХАМТРАЛААС ШУУД ХАМААРНА  Тэрбээр “Үүссэн нөхцөл байдалтай холбогдуулан хичээл, сургалтын үйл ажиллагааны тасралтгүй байдлыг хангах зорилгоор үлдсэн хугацааны бүх хичээлийн агуулгыг зургадугаар сарын 1-ний өдрийг хүртэл үргэлжлүүлнэ. 2019-2020 оны хичээлийн жилд ерөнхий боловсролын сургуулийн бага ангийн сурагчид 160, дунд, ахлах ангийн сурагчид 165 өдөр тус, тус танхимд хичээллэхээс 85 өдөр буюу нийт хичээллэх хугацааны 51-53 хувийг танхимд хичээллэсэн байна.  Сүүлийн үед  эцэг эхчүүдийн зүгээс теле хичээлийг шүүмжлэх хандлага их гарах боллоо. Зарим хүмүүс цахим хуудаснаа “Теле хичээл муу зааж байна” гэх мэдээллийг зорилготойгоор сэвдэг болж.  Засгийн газраас олон мянган хүүхдүүдийн эрх ашгийг  хамгаалж боловсролын системийг хэвийн явуулахын тулд тэргүүлэх зэргийн багш нар батлагдсан хөтөлбөрийн дагуу өндөр түвшинд зохион байгуулж байна. Би хувьдаа багш нарыг хичээлээ сайн зааж байгаа гэж бодож байна. Хамгийн гол нь эцэг эхчүүдийн хяналт, хүүхдэдээ анхаарах анхаарал чухал. Теле хичээлийн үр дүн нь эцэг эх, багш, хүүхэд гурав хэр эргэх холбоотой ажилласан, эцэг эхчүүд хүүхдэдээ хэр дэмжиж, цаг гаргасан бэ гэдгээс шууд харагдана. Тиймээс зөвхөн багшаас хараат бус багш, хүүхэд, сургууль, эцэг эх зэрэг бүх талын эргэх холбоотой ажиллахыг анхааруулж байгаа” гэв. ИРГЭД ТЕЛЕ ХИЧЭЭЛИЙГ CD, DVD-Д ХУУЛБАРЛАН ЗАРАХ БОЛЖЭЭ Үүнээс гадна  хичээлийн хөтөлбөрт тохирсон агуулгаар цахим болон теле хичээлийг CD, DVD-д хуулбарлан зарж ашиг олох үйлдэл гарах болжээ. Энэ чиглэлийн иргэдийг залилсан мэхэлсэн байгууллага, хувь хүнийг хуулийн байгууллагад хандан шалгуулан хариуцлага хүлээлгэх БСШУСЯ мэдэгдсэн юм. Хэрэв ирэх хичээлийн жилд  төсөв мөнгөний бололцоо байвал Ерөнхий боловсролын сургууль бүрт хичээл, сургалтыг нь дэмжих зорилгоор CD, DVD-г өгнө гэдгийг албаныхан хэлж байна.   Дашрамд дурдахад, теле хичээлийг www.econtent.edu.mn, www.hicheel.mn, www.aplus.mn сайтууд болон телевизийн сувгуудаас үнэ төлбөргүй хүлээн авах боломжтой юм. Э.БУРАМ",ЭНТЕРТАЙНМЕНТ
"Улсын онцгой комиссоос гарсан шийдвэрийн дагуу тусгай үүргийн нислэгээр 2020 оны дөрөвдүгээр сарын 30-нд БНСУ-ын Сөүл, тавдугаар сарын 2-нд ХБНГУ-ын Франкфурт хотоос иргэдээ татан авах бэлтгэл ажил хийгдэж байна. Энэ удаагийн тусгай үүргийн нислэгүүдээр ирэх иргэдийг шинээр бүртгэхгүй бөгөөд Монгол Улсаас гадаад улсад суугаа Элчин сайдын яамдаар дамжуулан Улсын онцгой комисст өнөөдрийг хүртэл ирүүлсэн нутаг буцах тухай 9412 өргөдөл, хүсэлтээс хүндэтгэн үзэх шалтгаантай иргэдийн өргөдөл, холбогдох нотлох материалыг хариуцаж буй ЭСЯ-даар дамжуулан хүлээн авч УОК-ын Шуурхай штаб шийдвэрлэнэ. Зорчигчдын бүртгэлд УОК-ын зүгээс тавьж буй дараах шаардлагыг баримтална. Үүнд, Бүртгэл нь баталгаажсан талаарх мэдээллийг Элчин сайдын яамаар нь дамжуулан тухайн иргэдэд хүргэх бөгөөд Эрүүл мэндийн яамнаас тавьж буй шаардлагын дагуу нутаг буцах иргэд сүүлийн 48 цагийн дотор коронавирусийн шинжилгээ  заавал хийлгэсэн байна. Дээрх шаардлагууд нь транзитаар ирэх иргэдэд ч мөн адил хамаатай болохыг анхаарна уу.",ЭНТЕРТАЙНМЕНТ
Нийтлэлийн мэдээлэл,Ангилал
"Дэлхий нийтэд тархаад буй Коронавирусийн халдвар өнөөдрийн байдлаар Монгол улсад 34 дэх тохиолдол бүртгэгдээд байна. Үүнтэй холбогдуулан Хан-Уул дүүргийн онцгой комисс 21 хороодын Засаг дарга нартай цахим хурлыг өнөөдөр /2020.04.22/ 11.00 цагт зохион байгууллаа.  Дүүргийн Цагдаагийн газар, Эрүүл мэндийн төв  Онцгой байдлын хэлтсээс хийгдэж байгаа болон цаашид авч хэрэгжүүлэх ажлын талаар хэлэлцлээ.  Хурлын дараа Хан-Уул дүүргийн Засаг дарга бөгөөд Онцгой комиссын дарга Ж.Алдаржавхлан Улсын онцгой комиссын 2020 оны “Зорчигч тээврийн хөдөлгөөнийг хэсэгчлэн түр зогсоох тухай"" 10 дугаар тогтоол, Нийслэлийн засаг даргын “Нийслэлээс гарах, орох хөдөлгөөнийг түр зогсоох тухай” А/560 дугаар захирамжийг хэрэгжүүлэх ажлын хүрээнд хяналтын цэгүүдийн орох, гарах хөдөлгөөний мэдээ мэдээллийг нэгтгэн танилцуулах, сүүлийн үед иргэд тайвширч амны хаалтаас  татгалзах болсонтой холбогдуулан олон нийтийн цагдаа буюу хэсгийн ахлагч нарын иргэдэд тавих шаардлагыг эрчимжүүлэх, олон хүн цуглуулахгүй байх, хараа хяналтыг сайжруулах, хийгдсэн ажлыг баримтжуулан ажиллах үүрэг чиглэл өглөө. ЭХ СУРВАЛЖ: ХУД",Нийгэм
" COVID-19, амны хаалт Коронавируст (COVID-19) халдвараас сэргийлье!!!Яагаад заавал амны хаалт зүүх хэрэгтэй вэ? Posted by Нийгмийн эрүүл мэндийн үндэсний төв on Tuesday, April 21, 2020",Нийгэм
"Нийслэлийн Баянзүрх дүүргийн Засаг даргын Тамгын газраас мал амьтны гоц халдварт шүлхий өвчинтэй тэмцэх, урьдчилан сэргийлэх арга хэмжээг шат дараатай авч байгаа билээ. Тодруулбал, дүүргийн Засаг даргын  А/128 тоот захирамжийн хэрэгжилтийг хангах ажлын хүрээнд  дүүргийн 11, 20 дугаар хорооны мал бүхий 771 өрхийн нийт 41.309 толгой мал, амьтанд шүлхий өвчнөөс урьдчилан сэргийлэх вакцин хийсэн байна. Мөн энэ үеэр мал бүхий зарим айл өрхөөр орж малчны өрхийн дэвтэр, малчны тамга тэмдэг болон шүлхий өвчнөөс урьдчилан сэргийлэх вакцин таригдсан эсэхэд хяналт тавьж ажилласан байна хэмээн Баянзүрх дүүргийн ЗДТГ-ын Хэвлэл мэдээллийн албанаас мэдээллээ.",Нийгэм
"Баянзүрх дүүргийн Засаг даргын Тамгын газраас шинэ төрлийн коронавирус буюу ‘’КОВИД-19’’-ийн халдварын тархалтаас урьдчилан сэргийлэх, иргэдийг эрүүл аюулгүй орчинд амьдрах нөхцөлөөр хангах зорилтын хүрээнд дүүргийн хэмжээнд нэн шаардлагатай айл өрхүүдийн нүхэн жорлонг ариутгах ажлыг эхлүүлсэн. Эхний ээлжинд 16.831 өрхийн нүхэн жорлонг ариутгахаар төлөвлөж ажилдаа орсон бөгөөд өнөөдрийн байдлаар ажлын явц 76 хувьтай байна хэмээн Баянзүрх дүүргийн ЗДТГ-ын Хэвлэл мэдээллийн албанаас мэдээллээ. ",Нийгэм
"Нийслэлийн Эрүүл мэндийн газраас Монголын хувийн хэвшлийн эрүүл мэндийн байгууллагын нэгдсэн холбоо, ХӨСҮТ-тэй хамтран коронавируст халдвараас урьдчилан сэргийлэх, бэлэн байдлыг хангах, хариу арга хэмжээний үзүүлэх сургалтыг зохион байгууллаа. “Халиун толгой”, “Мөнгөн гүүр” эмнэлэгт зохион байгуулагдсан тус үзүүлэх сургалтанд хувийн хэвшлийн амбулаторийн болон хэвтүүлэн эмчлэх тусламж, үйлчилгээ үзүүлж буй 40 эрүүл мэндийн байгууллагын эмч, эмнэлгийн мэргэжилтэн оролцсон юм. Энэ хүрээнд коронавируст “Ковид-19” халдвараас урьдчилан сэргийлэх, бэлэн байдлыг хангах, хариу арга хэмжээний үйл ажиллагаанд мөрдөх тушаал, шийдвэр, заавар, түр зөвлөмжүүдийг танилцуулж, авч хэрэгжүүлэх чиглэлээр мэргэжил арга зүйн зөвлөгөө өглөө. Мөн энэхүү сургалтыг цаашид өртөөчилсөн дадлага, сургалт байдлаар зохион байгуулж, эрүүл мэндийн байгууллагууд туршлага солилцох боломжтой бөгөөд халдварын сэжигтэй тохиолдлыг илрүүлэх, урьдчилан сэргийлэх ажлыг видео хичээл болгон эмнэлгүүдэд тараах юм байна. НИЙСЛЭЛИЙН ЭРҮҮЛ МЭНДИЙН ГАЗАР",Нийгэм
"Нийслэлийн Засаг дарга бөгөөд Улаанбаатар хотын Захирагчийн 2016-2020 оны үйл ажиллагааны хөтөлбөрт нэг  хүнд  ногдох  ногоон байгууламжийн хэмжээг нэмэгдүүлэх, хотын тоосжилтыг бууруулах зорилгоор гудамж талбайг зүлэгжүүлэхээр тусгасан билээ. Энэ хүрээнд хотын Захирагч С.Амарсайхан иргэдийн ажиллаж амьдрах орчин нөхцлийг сайжруулахын тулд ногоон байгууламжийн хэмжээг нэмэгдүүлж шинээр байгуулах,  сул шороо хөрс ихтэй газруудыг зүлэгжүүлж ногоон байгууламж бүхий газруудын арчлалт хамгаалалтыг эрчимжүүлэх үүргийг Улаанбаатар хотын Захирагчийн ажлын албанд өгсөн юм.  Улаанбаатар хотын Захирагчийн ажлын албанаас нийслэлийн хэмжээнд сул шороо ихтэй зүлэгжүүлэлт, иж бүрэн ногоон байгууламж, ойн төгөл хийх шаардлагатай 157 байршлыг тогтоож ногоон байгууламж хийж буй. Энэ жилийн хувьд нийслэлд нийт 122 га талбайд ногоон байгууламж, 13 байршилд ойн төгөл шинээр хийгдэж байгаа талаар Улаанбаатар хотын ЗАА-ын Ногоон байгууламжийн бодлогын асуудал хариуцсан мэргэжилтэн Д.Сүхбат хэллээ. Тэрбээр “Нийслэлийн Засаг даргын өгсөн үүргийн дагуу Улаанбаатар хотод ногоон байгууламжийн тоог нэмэгдүүлэхээр ажиллаж байна. Сул шороо ихтэй явган хүний зам дагасан байршлуудад болон орон сууцны хороолол дунд ойн төгөл хийгдэнэ” гэв.  Нийслэлийн хэмжээнд ногоон байгууламжийг нэмэгдүүлэх хүрээнд одоогийн байдлаар Бээжингийн гудамж буюу БНХАУ-ын Элчин сайдын яам болон  БНЭУ-ын Элчин сайдын яамны урд талбай, Монгол Улсын Консерватори /Хөгжим бүжгийн коллеж/-ийн урд, зүүн талбай дагуу нийт 66ш том оврын нарс мод, 113ш гацуур мод тарьж 1200ш боролзгоноор 376урт метрийн   ургамалан хашлага үүсгэж түүнийгээ троссон хашлагаар хамгаалж хийж гүйцэтгэсэн байна. Мөн дээрх байршлуудад тэхийн шээг, голт бор, монос, нохойн хошуу зэрэг 105ш гоёлын мод бутыг  тарьж 900м.кв талбайг зүлэгжүүлэхээр төлөвлөжээ. Мөн Долоон буудал буюу Чингэлтэйн гудамжны зам дагуу 920ш улиас модыг суулгаж зүлэгжүүлэх бөгөөд Ногоон нүдэн нуурын гудамж Тасганы овоо болон Ард аюушийн өргөн чөлөөнд бортоготой гацуур мод, том оврын нарс зэргийг суулгаж тохижуулж эхэлжээ.  НЗДТГ-ын Хэвлэл мэдээлэлтэй харилцах хэлтэс",Нийгэм
